{
  "schema": "ges.acceptance-evidence.v1",
  "ts": "2026-09-16T05:37:42.768153+00:00",
  "command": "pytest -q tests/ges6",
  "exit_code": 0,
  "acceptances": {
    "A01": "PASS",
    "A02": "PASS",
    "A03": "PASS",
    "A04": "PASS",
    "A05": "PASS",
    "A06": "PASS",
    "A07": "PASS",
    "A08": "PASS",
    "A09": "PASS",
    "A10": "PASS",
    "A11": "PASS",
    "A12": "PASS",
    "A13": "PASS",
    "A14": "PASS",
    "A15": "PASS",
    "A16": "PASS",
    "A17": "PASS",
    "A18": "PASS",
    "A19": "PASS",
    "A20": "PASS",
    "A21": "PASS",
    "A22": "PASS",
    "A23": "PASS",
    "A24": "PASS",
    "A25": "PASS",
    "A26": "PASS",
    "A27": "BLOCKED"
  }
}
